,Topic_0,Topic_1,Topic_2,Topic_3,Topic_4,Topic_5,Topic_6,Topic_7
San Luis Potosi,"empresa, planta, económico, proyecto, desarrollo, potosino, carrera, lugar, contar, producción, bmw, trabajo, encontrar, casa, industrial","centro, pueblo, equipo, lugar, cultural, actividad, potosino, quadratín, uaslp, presentar, museo, diciembre, historia, cultura, universidad","salud, gobernador, secretaría, federal, estatal, pandemia, servicio, hospital, medida, centro, trabajo, sanitario, contagio, zona, paciente","cártel, delito, homicidio, realito, zona, pozo, obra, vida, barrio, violencia, servicio, avenida, red, alemán, registrar","transporte, confirmar, potosino, oficial, enfermedad, secretaría, centro, zona, unidos, leer, servicio, sct, destacado, taxista, situación","quadratín, municipio, quadratín slp, municipal, matehuala, empresa, seguridad, mujer, noviembre, encontrar, diciembre, feria empleo, matehuala empresa mayo, empleo matehuala empresa, matehuala empresa","registrar, caída, canaco, lluvia, potosino, pozo, principal, médico, real, autopart, sector, número, dengue, visitar, sequía","may, hombre, detener, policía, mujer, capital, litro, video, irapuato, víctima, asesinar, huachicol, investigar, asalto, pesos"
Sinaloa,"ántrax, chino, chino ántrax, mayo, banda, grupo, aréchiga, gamboa, hombre, encontrar, josé, cártel, mazatlán, aréchiga gamboa, casa","cártel, guzmán, grupo, criminal, chapo, seguridad, unidos, mayo, hijo, organización, zambado, dorado, federal, arma, encontrar","cártel, criminal, organización, grupo, droga, cjng, zona, gente, asegurar, tema, organización criminal, presencia, soto, sexual, abuso","animal, salud, santuario, ostok, mantener, civil, servicio, santuario ostok, operativo, periodo, espacio, agua, hospital, secretario, atender","chapo, guzmán, fentanilo, cártel, unidos, cuerpo, mujer, droga, asegurar, hijo, químico, encontrar, seguridad, joaquín, chapo guzmán","liga, unidos, mayo, mazatlán, equipo, hombre, cártel, zambado, detener, asegurar, temporada, narco, julio, sinaloense, lugar","pesos, empresa, mazatlán, social, centro, proyecto, deber, municipio, trabajo, contar, encontrar, servicio, salud, grupo, ley","cártel, guzmán, chapo, droga, unidos, mayo, zambado, garcía, seguridad, dea, criminal, hijo, organización, dinero, federal"
Sonora,"pueblo, vida, querer, familia, casa, lugar, padre, historia, buscar, vivir, pasar, hijo, comunidad, recibir, gente","agua, martes, educación, ley, mayo, estudiante, materia, cultivo, campo, forma, producción, consumo, distribución, uniforme, cultivo consumo","pitic, pesos, fiesta, fiesta pitic, obra, social, buscar, archivo, sonorens, foro, ofrecer, mundial, obregón, acción, empresa","salud, agua, durazo, federal, autoridad, secretario, municipal, alfonso, municipio, deber, seguridad, secretaría, empresa, social, riesgo","violencia, mujer, justicia, ley, investigación, delito, nier, empresa, olimpia, fiscal, asesinato, oro, penal, claudia, trabajo","encontrar, autoridad, seguridad, grupo, policía, cártel, armado, joven, vida, investigación, víctima, elemento, vehículo, cuerpo, operativo","banda, música, metal, álbum, paul, rock, concierto, tocar, disco, escuchar, historia, canción, lugar, grabar, grupo","música, banda, canción, banda sonoro, película, tema, musical, sonido, historia, disco, artista, mundo, escuchar, vida, serie"
Tabasco,"agua, río, lluvia, inundación, municipio, afectado, presa, nivel, villahermosa, centro, civil, protección civil, frente, informar, población","banda, hospital, lugar, grupo, encontrar, vida, centro, mujer, deber, social, manuel, salud, obrador, quedar, dejar","niño, perro, mundo, peso, red, social, red social, acción, cocina, servicio, tomar, lupita, calle, romper, internet","venta, ley, abril, homicidio, bebida, municipio, salud, puma, villahermosa, kalimba, federal, producto, menor, funcionario, alimento","maya, sitio, aguada, fénix, aguada fénix, arqueológico, antiguo, cultural, historia, estructura, construcción, región, proyecto, lugar, tierra","salud, secretaría, pesos, empresa, diario, estatal, josé, federal, señalar, villahermosa, actividad, medida, municipio, hernández, encontrar","cunduacán, agente, tránsito, centro, agente tránsito, villahermosa, ataque, señalado, vida, presunto, hombre, pipa, localizar, armado, lunes","cunduacán, tránsito, seguro, declarar, servicio, bienestar, ayuntamiento, unidad, equipo, temperatura, civil, paraíso, falta, protección civil, trabajar"
Tamaulipas,"cártel, policía, fiscalía, grupo, encontrar, golfo, estatal, vehículo, autoridad, delito, armado, seguridad, elemento, arma, noreste","seguridad, issste, justicia, sexual, asegurar, secretario, abuso, abuso sexual, judicial, sueldo, trabajador, contar, migrant, revelar, familia","salud, victoria, hospital, matamoros, matamoro, medida, reynosa, personal, sanitario, ángel, servicio, pandemia, contagio, coronavirus, trabajador","laredo, mario, maestro, mujer, historia, portillo, vida, querer, pasar, mario portillo, niño, escuela, gustar, familia, encontrar","agua, tampico, pedir, calor, rosalía quintá, quintá, rosalía, colonia, zona, contar, organismo, sector, madero, uresti, emprendedor","zona, municipio, protección, cfe, agua, victoria, servicio, playa, sistema, madero, familia, civil, incendio, informar, línea","federal, garcía, gobernador, pesos, cabeza, empresa, vaca, cabeza vaca, seguridad, reynosa, municipal, proceso, estatal, garcía cabeza, garcía cabeza vaca","tampico, agencia, lugar, calle, autor agencia, municipal, zona, baldemar, baldemar mijango, mijango, colonia, obra, victoria, encontrar, cuerpo"
Tlaxcala,"sol, torre, torre sol, rosaiselar torre, rosaiselar torre sol, rosaiselar, empresa, económico, robo, perro, empleo, calle, edad, centro, reportar","mujer, familia, municipio, comunidad, encontrar, violencia, hombre, delito, investigación, autoridad, social, escuela, padre, lugar, grupo","municipio, municipal, obra, comunidad, desarrollo, agua, social, tlaxcalteca, ayuntamiento, pesos, federal, familia, sánchez, recurso, calle","salud, pandemia, municipio, sanitario, contar, social, municipal, deber, lugar, producto, contagio, encontrar, pesos, medida, estatal","trabajo, planta, espectáculo, apizaco, despensa, queja, obra, ayuntamiento, uatx, recurso, ciudadano, títere, espectáculo títere, encontrar, cuna","electoral, estatal, partido, federal, trabajo, político, local, proceso, deber, ciudadano, instituto, gobernador, municipal, servicio, ine","servicio, medida, autoridad, lugar, equipo, seguridad, salud, agua, encontrar, sanitario, hora, grupo, unidad, personal, centro","accidente, vida, altura, dejar, personal, hombre, tráiler, carretera, salud, bosque, joven, camioneta, autoridad, vehículo, responsable"
Veracruz,"agua, puerto, zona, empresa, servicio, obra, pesos, encontrar, contar, río, kilómetro, proyecto, región, sistema, afectado","equipo, pesos, secretaría, liga, social, empresa, desarrollo, federal, gobernador, garcía, estatal, administración, trabajo, trabajador, nombre","universidad, veracruzán, académico, compartir, vida, equipo, salud, casa, escuela, facebook, región, facultad, social, programa, educación","periodista, seguridad, pedir, nahle, rocío, rocío nahle, periodista avisack, avisack, rodríguez, atentado, temperatura, periodista avisack dougla, dougla, avisack dougla, alto","xalapa, encontrar, autoridad, policía, seguridad, grupo, mujer, cuerpo, lugar, investigación, zona, municipal, estatal, fiscalía, elemento","córdoba, agua, mayo, buque, cuauhtémoc, señalar, calor, candidata, comunidad, campaña, denuncia, votar, amigo, desfile, amenaza","río, incendio, lluvia, orizar, norte, zona, cerro, cruz, blanco, río blanco, electoral, temperatura, agua, cerro cruz, centro","hospital, salud, xalapa, médico, autoridad, sanitario, medida, contagio, atender, paciente, venta, coronavirus, servicio, hombre, reportar"
Yucatan,"salud, servicio, estatal, mérida, medida, empresa, sanitario, vila, gobernador, centro, económico, seguridad, contar, dosal, vila dosal","mérida, lugar, zona, maya, contar, centro, turístico, pesos, trabajo, producto, hotel, turismo, arqueológico, gente, restaurante","contraseña, mérida, calle, policía, enfermedad, noticia, muerte, salud, mujer, casa, noticia destacado, destacado, edad, vida, presentar","mérida, vida, familia, diario, josé, hijo, número, maría, ayer, joven, padre, recibir, yucateco, casa, carlos","jornada, político, sheinbaum, sociedad, asegurar, informar, seguridad, interés, crédito, aumentar, convocatoria, tren, marco, carga, fiscal","efectivo, descubrir, paso, completo, aprender, conflicto, remesa, guía, error, veterinario, conexión, droga, mezcla, resolver, advertir","huracán, agua, tormenta, península, zona, tropical, lluvia, hora, delta, viento, proceso, costa, delito, centro, ley","maya, agua, comunidad, municipio, mujer, especie, lugar, zona, natural, proyecto, desarrollo, pueblo, vivir, cenot, animal"
Zacatecas,"acción, director, secretaría, vehículo, crear, estadounidense, venta, taxi, chino, vender, mercado, funcionamiento, incertidumbre, hsbc, vender acción","uaz, rector, ley, exigir, protesta, congreso, esperar, afectar, noticia, nota, sierra, relacionado, nota relacionado, nota relacionado noticia, relacionado noticia","competencia, zacatecano, estatal, charrería, mujer, cabo, evento, seguridad, plata, campeonato, olimpiada, óvalo, competencia cabo, olimpiada charrería, policía","salud, encontrar, centro, actividad, lugar, cultura, cultural, capital, contar, sanitario, museo, espacio, historia, contagio, histórico","cártel, municipio, encontrar, grupo, cueva, humano, seguridad, cjng, policía, zona, investigación, cuerpo, sitio, hombre, homicidio","capital, zac, compartir, quedar, servicio, taller, existir, cualquiera, interesar, previo, lugar, escrito, municipio, contenido, edición","grupo, aguilar, municipio, minero, equipo, flor, mujer, familia, video, cártel, antonio, silvestre, flor silvestre, estatal, tello","elemento, aguascalient, asegurar, vida, detener, sexual, abuso, abuso sexual, maría, cuerpo, cubano, jesús, tom cruise, tom, soto"
Ciudad de México,"salud, hospital, medida, pandemia, contagio, sanitario, deber, coronavirus, médico, autoridad, sheinbaum, centro, servicio, semáforo, actividad","agua, zona, proyecto, alcaldía, obra, pesos, programa, área, sistema, urbano, trabajo, espacio, capitalino, servicio, construcción","mujer, ley, congreso, derecho, violencia, comisión, social, diputado, local, derechos, humanos, derechos humanos, justicia, protección, diputada","museo, centro, calle, histórico, colonia, plaza, cdmx, avenida, miguel, espacio, arte, centro histórico, juárez, cuauhtémoc, obra","casa, cultura, cultural, lugar, hora, encontrar, social, vivir, vida, sismo, mundo, historia, red, cdmx, actividad","seguridad, autoridad, grupo, investigación, unión, policía, contenido, fiscalía, tepito, cártel, alcaldía, delito, homicidio, asesinato, criminal","seguridad, metro, policía, educación, ciudadano, protección, línea, cdmx, estación, ssc, servicio, riesgo, atención, seguridad ciudadano, apoyo","activo, contagio, confirmado, defunción, coronavirus, salud, enfermedad, muerte, número, registrar, acumulado, hora, cdmx, cama, sospechoso"
