,Topic_0,Topic_1,Topic_2,Topic_3,Topic_4,Topic_5,Topic_6,Topic_7
Aguascalientes,"servicio, edad, empresa, municipio, puesto, sexo, encontrar, salud, municipal, horario, presentar, experiencia, deber, policía, vacante","contenedor, agua, noticia, empresa, contar, servicio, sanitario, lograr, operar, obra, temperatura, llamar, principalmente, pedir, suspensión","nissan, producto, pesos, familia, centro, encontrar, producción, servicio, económico, contar, lugar, nivel, pedir, deber, mercado","servicio, mujer, empresa, encontrar, social, deber, transporte, familia, contar, vida, proyecto, trabajo, desarrollo, programa, juan","empresa, encontrar, policía, salud, médico, trabajador, hora, personal, estatal, servicio, municipal, presentar, proceso, pesos, seguridad","agua, estatal, sanitario, salud, centro, municipio, municipal, internacional, servicio, lugar, animal, seguridad, medida, autoridad, jesús","necaxa, educación, proyecto, equipo, participar, atleta, trabajo, partido, vida, electoral, destacar, lograr, obra, instituto, arquitectura","mujer, autoridad, municipio, menor, justicia, juez, lugar, encontrar, contar, centro, federal, delito, derecho, comisión, estatal"
Baja California,"paz, banda, asegurar, mujer, encontrar, violencia, local, alto, cabo, zona, punto, mantener, planta, capacidad, casa","deportado, tijuana, estudiante, asalto, cadavérico, trasplante, sscbc, trasplante cadavérico, dólar, lugar, noticia, sistema, continuar, relacionado, mexicali","mexicali, camión, zona, pagar, denunciar, reportar, deber, valle, incendio, vial, peritaje, federal, confirmar, investigación, colonia","servicio, cabo, información, paz, vino, estatal, sanitario, ferri, empresa, seguridad, ruta, producto, mexicali, homicidio, negocio","salud, tijuana, hospital, paciente, coronavirus, médico, contagio, número, muerte, imss, mexicali, confirmado, social, pandemia, activo","cabo, pesos, empresa, servicio, hectárea, producción, estatal, municipio, desarrollo, paz, mexicali, gobernador, contar, salud, secretaría","estatal, autoridad, tijuana, paz, investigación, seguridad, mujer, policía, salud, encontrar, fiscalía, cártel, centro, cabo, cuerpo","agua, cabo, zona, encontrar, viento, lugar, hora, especie, mar, marino, paz, norte, playa, empresa, temperatura"
Baja California Sur,"marino, encontrar, autoridad, salud, municipio, protección, especie, zona, área, investigación, ballena, social, comisión, vida, lobo","salud, servicio, zona, señalar, médico, centro, área, contar, autoridad, actividad, social, playa, pandemia, federal, informar","agua, alto, mantener, punto, local, litro, capacidad, turístico, planta, instalar, palmera, arbusto, casa, zona, encontrar","salud, grupo, seguridad, estatal, sistema, zona, servicio, policía, señalar, norte, centro, municipio, colonia, encontrar, secretaría","playa, tortuga, marino, red, encontrar, autoridad, paz bcs, viento, zona, especie, deber, social, josé, municipio, hora","playa, zona, hora, agua, autoridad, servicio, marino, señalar, norte, turismo, municipio, medida, deber, contar, grado","playa, trabajo, misión, encontrar, agua, deber, autoridad, estatal, ciudadano, padre, municipio, social, trabajador, presentar, salud","viento, encontrar, hora, cielo, temperatura, salud, mínimo, semáforo, lluvia, registrar, informar, color, zona, activo, presentar"
Campeche,"lluvia, fuerte, viento, racha, temperatura, eléctrico, chubasco, pesos, norte, descarga, descarga eléctrico, hora, acompañado, intervalo, puntual","salud, zona, servicio, carmen, encontrar, agua, social, pesos, deber, maya, personal, secretaría, sanitario, señalar, municipio","jornada, culiacán, servicio, sociedad, zona, presentar, encontrar, comunidad, maya, explicar, problema, energía, deber, evitar, especie","salud, pesos, empresa, contagio, municipio, autoridad, trabajador, federal, maya, maíz, plataforma, centro, secretaría, medida, soya","maya, tren, tren maya, proyecto, zona, contar, comunidad, servicio, salud, incendio, tramo, carmen, construcción, encontrar, isla","proyecto, comunidad, empresa, zona, maya, hora, encontrar, tren, noticia, pueblo, plataforma, federal, sistema, municipio, agua","carmen, maya, zona, jornada, turismo, pemex, culiacán, presentar, encontrar, trabajador, lugar, autoridad, salud, sociedad, plataforma","noticia, destacado, encontrar, noticia destacado, carmen, trabajo, lugar, contar, zona, obra, pesos, militar, población, municipio, compartir"
Chiapas,"acteal, grupo, masacre, justicia, tonelada, equipo, víctima, señalar, región, tren, internacional, actividad, vida, producción, militar","trasladar, tuxtla, presunto, casa, lesionado, médico, instancia, cristóbal, gutiérrez, tuxtla gutiérrez, instancia médico, detener, elemento, dejar, hombre","comunidad, municipio, humanos, derechos, derechos humanos, casa, educación, familia, social, indígena, situación, niño, vida, mujer, estatal","riesgo, tapachula, precio, control, mosca, puerto, dejar, soconusco, abeja, vuelo, humanitario, carretera, madero, función, exigir","especie, natural, cañón, sumidero, cañón sumidero, área, lugar, agua, protegido, parque, área natural, natural protegido, área natural protegido, conanp, sitio","exigir, justicia, normalista, fraude, víctima, pedir, tuxtla, elección, niña, jesús, capital, vecino, pigmento, natural, escuela","municipio, agua, pesos, zona, trabajo, proyecto, casa, lluvia, secretaría, protección, población, servicio, río, centro, mencionar","mujer, salud, pandemia, comunidad, trabajo, hospital, médico, partera, joven, muerte, pasar, atención, atender, social, indígena"
Chihuahua,"homicidio, cnte, sheinbaum, funcionario, homicidio funcionario, secretario, segob, encuentro, palacio, político, federal, viernes, presidenta, regidor, diputado","liga, dorado, campeón, temporada, celebrar, santa, rodeo, rita, instructor, santa rita, liderar, competencia, categoría, medalla, entrenador","grupo, vida, fiscalía, mujer, elemento, familia, asegurar, hombre, arma, víctima, guardia, municipio, lugar, pasar, zona","municipio, ofrecer, servicio, ofrecer servicio, licitación, inicial, incendio, pensión, uach, sequía, investigar, exigir, madera, parral, comenzar","gobernador, corral, político, federal, estatal, investigación, justicia, fiscalía, duarte, electoral, césar, javier, pesos, marisela, javier corral","banda, metal, paul, álbum, música, grupo, lugar, escuchar, rock, trump, dejar, llamado, tocar, querer, disco","banda, metal, álbum, rock, grupo, paul, música, tocar, lugar, grabar, madre, canción, trump, concierto, publicar","agua, salud, servicio, centro, estatal, atención, municipio, social, señalar, buscar, desarrollo, personal, área, colonia, trabajo"
Coahuila,"torreón, universidad, escuela, salud, área, recibir, vida, río, vacuna, proceso, médico, personal, encontrar, servicio, social","empresa, salud, región, medida, económico, carbón, trabajador, sanitario, servicio, producción, industria, federal, sector, secretaría, deber","electoral, vino, casa, partido, encontrar, municipio, local, contar, pueblo, lugar, pri, distrito, político, don, torreón","saltillo, mujer, torreón, familia, casa, centro, hombre, violencia, autoridad, salud, social, encontrar, vida, programa, monclova","agua, zona, torreón, lluvia, viento, civil, municipio, fuerte, protección, norte, hora, vivienda, protección civil, encontrar, dejar","saltillo, región, lugar, centro, seguridad, zona, torreón, municipio, pesos, encontrar, contar, secretaría, laguna, historia, grupo","desarrollo, seguro, calidad, servicio, aumentar, acceder, ciudadanía, ambiente, acceder servicio, salud, sector, autoridad, infraestructura, atender, construir","cuerpo, hospital, imss, médico, paciente, salud, social, personal, plan, exhumación, panteón, seguro, fosa, seguro social, torreón"
Colima,"zona, protección, lluvia, fuerte, parque, civil, hora, temperatura, protección civil, actividad, servicio, costa, mantener, metro, tormenta","federal, juez, partido, mujer, esposa, seguridad, justicia, electoral, investigación, penal, político, asesinato, alianza, fiscalía, judicial","salud, educación, estatal, social, secretaría, seguridad, escuela, servicio, álvarez, hospital, director, médico, mujer, deber, educativo","gobernador, sánchez, salud, informar, peralta, confirmado, contagio, estatal, coronavirus, diputada, pesos, encontrar, manzanillo, mayo, medida","pesos, cerveza, empresa, proyecto, encontrar, cervecería, colimo, servicio, agua, lugar, informar, obra, zona, municipio, pandemia","seguridad, delito, grupo, centro, casa, arma, encontrar, homicidio, droga, registrar, alto, social, interno, tipo, puerto","equipo, colimense, mujer, vehículo, álvarez, federal, lugar, futbol, encontrar, historia, municipio, fallecer, accidente, estatal, pagar","manzanillo, encontrar, policía, municipio, zona, lugar, elemento, seguridad, puerto, autoridad, federal, secretaría, cuerpo, comunidad, estatal"
Durango,"municipal, social, área verde, verde, paz, área, candidato, programa, seguro, territorio, pedir, sistema, municipio, zona, calidad","salud, encontrar, zona, municipio, hospital, servicio, lugar, municipal, señalar, personal, hora, médico, estatal, trabajo, informar","vida, hombre, accidente, fallecer, gómez palacio, gómez, palacio, perder, motocicleta, morir, edad, joven, lerdo, perder vida, impactar","elección, elección elección, elección elección elección, face, amorebieto, azoka, tip, tip tip, columna, área, tip tip tip, concurso, noticia, asociación, baloncesto","vida, familia, actor, mujer, serie, querer, hijo, red, historia, social, mundo, compartir, casa, vivir, carrera","publicidad, participación, bilbao, cambio, aficionado, cerveza, inglés, plaza, club, torneo, noticia, profesional, ayuntamiento, servicio, duranguens","dodge, srt, hellcat, modelo, motor, movimiento, srt hellcat, suv, versión, contar, movimiento ciudadano, sistema, dodge srt, agua, lozano","instagram, publicación, publicación instagram, imagen, instagram publicación, eta, instagram publicación instagram, foto, mostrar, publicación instagram publicación, fotografía, sitio, video, historia, red"
Guanajuato,"mayo, salud, maestro, ssg, familia, personal, apoyo, estudiante, escuela, red, seg, sector, fortalecer, estrategia, estatal","arma, momia, municipal, dosis, museo, detención, asegurar, cartucho, hombre, droga, policía, delito, fuego, seguridad, arma fuego","agua, celaya, turismo, mayo, turístico, impulsar, municipal, estudiante, familia, miguel, destacar, sector, agua potable, potable, obra","homicidio, sheinbaum, rubio, real, observatorio, robo, ayer, diplomático, embajada, cisjordania, disparo, judicial, violencia, ejército, diplomático cisjordania","policía, movilidad, industria, joven, masacre, fiscal, foro, orgánico, trabajo, favor, destacar, director, estudiante, felipe, edificio","lugar, encontrar, agua, miguel, contar, zona, vida, municipal, capital, josé, casa, salud, trabajo, deber, mujer","empresa, pesos, desarrollo, inversión, planta, producto, gobernador, industria, sector, producción, económico, rodríguez, empleo, contar, proyecto","cártel, marro, seguridad, grupo, rosa, santa, santa rosa, autoridad, criminal, lima, rosa lima, santa rosa lima, fiscalía, celaya, cártel santa"
Guerrero,"equipo, jugar, querer, partido, pasar, vida, jugador, club, volver, hospital, mundo, liga, vivir, médico, trabajo","agua, lluvia, zona, escuela, falta, alto, denunciar, salud, riesgo, protección civil, civil, temperatura, unidad, incendio, registrar","obra, agua, centro, libro, historia, proyecto, espacio, josé, cultura, personaje, trabajo, autor, miguel, presentar, homicidio","acapulco, municipio, policía, grupo, autoridad, zona, informar, chilpancingo, paolo, seguridad, estatal, encontrar, fiscalía, salud, municipal","ataque, colonia, chilpancingo, acapulco, balazo, arma, zona, confirmar, muerto, seguridad, kilómetro, explosivo, reportar, morir, fuego","banda, metal, encontrar, vida, dejar, querer, lugar, pasar, grupo, casa, deber, historia, música, escuchar, paul","instagram, background, adabel, flex, border, red, color, josé, red social, font, video, center, social, foto, lucir","mujer, comunidad, pueblo, social, programa, trabajo, político, vida, proyecto, proceso, desarrollo, derecho, violencia, federal, universidad"
Hidalgo,"seguridad, policía, colonia, calle, municipio, miguel, estatal, electoral, municipal, autoridad, encontrar, hombre, elemento, federal, grupo","mayo, redacción, criterio, criterio mayo, redacción criterio, redacción criterio mayo, mayo redacción, mayo redacción criterio, criterio mayo redacción, sesión, hospital, salud, médico, paciente, iniciar","salud, sanitario, medida, agua, evitar, pandemia, servicio, centro, informar, riesgo, actividad, mantener, deber, contagio, zona","mujer, tormenta, causar, servicio, smn, judicial, mayo, noticia, relacionado, nota relacionado noticia, relacionado noticia, nota relacionado, nota, diputado, municipio","familia, vida, trabajo, querer, mujer, casa, historia, equipo, hijo, pasar, trabajar, vivir, mundo, gente, contar","municipal, municipio, partido, obra, candidato, pueblo, mineral, pri, miguel, social, comunidad, independencia, ayuntamiento, trabajo, político","policiaco, tula, vida, accidente, lesionado, encontrar, parque, ocurrir, hora, natural, lugar, registrar, noche, cabaña, zona","universidad, mujer, uaeh, social, instituto, estudio, desarrollo, programa, educación, violencia, institución, trabajo, ciencia, universitario, escuela"
Jalisco,"mujer, víctima, seguridad, delito, registrar, policía, justicia, violencia, fiscalía, vehículo, comenzar, condición, penal, término, estatal","charro, ley, marca, forestal, propiedad, industrial, propiedad industrial, impi, atrás, mujer, bosque, proteger, aborto, equipo, caballo","cártel, cjng, grupo, criminal, mencho, generación, organización, cártel generación, droga, federal, unidos, seguridad, oseguera, líder, autoridad","sandoval, cuerpo, fiscalía, encontrar, desaparecido, vallarta, puerto, policía, investigación, autoridad, municipio, puerto vallarta, desaparición, gobernador, informar","salud, hospital, empresa, médico, servicio, municipio, pesos, pandemia, sanitario, deber, atención, social, medida, secretaría, población","partido, querer, gobernador, político, ciudadano, equipo, jal, guadalajara jal, buscar, mujer, familia, estadio, trabajo, deber, vida","seguro, niña, niño, concierto, internet, acceso, salto, presentar, programa, acceso internet, carretera, niña niño, carne, verde, cambiar","transporte, zona, municipio, centro, servicio, pesos, ruta, pueblo, contar, hora, secretaría, proyecto, espacio, actividad, encontrar"
Mexico,"agua, comunidad, forestal, bosque, natural, especie, empresa, ambiental, zona, área, recurso, desarrollo, ambiente, cambio, proyecto","político, querer, partido, historia, social, hablar, creer, obrador, pasar, grupo, gente, mundo, vida, dejar, movimiento","unidos, internacional, seguridad, política, obrador, derecho, deber, económico, economía, derechos, humanos, relación, derechos humanos, investigación, empresa","cultura, cultural, mundo, social, indígena, pueblo, universidad, centro, espacio, histórico, lugar, historia, comunidad, lengua, museo","salud, pandemia, social, población, servicio, trabajo, médico, económico, actividad, programa, hospital, medida, sector, atención, cuidado","contenido, youtube, política, cooki, aceptar, google, contagio, coronavirus, mundo, continuar, google youtube, querer, bbc, energía, muerte","suscripción, dispositivo, acceder, vacuna, añadir, añadir usuario, dispositivo querer, suscripción dispositivo, leer, cambiar, compartir, usuario, querer, experiencia, obrador","mujer, violencia, grupo, encontrar, lugar, muerte, autoridad, población, cártel, familia, organización, vivir, unidos, deber, policía"
Michoacan,"mujer, social, joven, vida, equipo, violencia, casa, familia, investigación, trabajo, niño, educación, fiscalía, derecho, red","gobernador, salud, partido, seguridad, aureol, político, estatal, silvano, electoral, silvano aureol, hospital, www, federal, conejo, diputado","paso, hijo, may, mirel, remesa, alto, presunto, mercado, aprender, cártel, operar, gestión, corazón, proteger, girar","comunidad, zona, municipio, agua, encontrar, lugar, pueblo, contar, región, medida, monarca, mariposa, población, especie, bosque","cártel, grupo, municipio, cjng, policía, criminal, hombre, armado, arma, seguridad, reputación, autodefensa, familia, elemento, zona","rescatar, recibir, apoyo, acusar, martínez, iem, sepultado, alfonso martínez, hora, reglamento, alfonso, promover, morena, indígena, pozo","com, cárdenas, lázaro, centro, lázaro cárdenas, municipio, secretaría, voz, seguridad, autoridad, mimorelia com, mimorelia, servicio, salud, pesos","producción, municipio, productor, desarrollo, tonelada, producir, estatal, sistema, hectárea, pesos, confirmar presencia, niño, ley, programa, rural"
Morelos,"funcionario, judicial, lluvia, mayo, escuela, horario, martes, acuático, manifestación, pedir, investigación, presentar, revisar, amenaza, declaración","colonia, municipio, cuernavaca, fiscalía, calle, seguridad, policía, autoridad, hombre, vehículo, encontrar, investigación, mujer, detener, víctima","cuernavaca, vida, encontrar, josé, lugar, niño, casa, social, maría, historia, red, mujer, joven, zapata, lograr","social, diario, partido, contar, deber, información, servicio, pesos, red, recibir, local, casa, cuernavaca, trabajo, blanco","cuautla, servicio, participar, ofrecer, perseverancia, incendio, basurero, lograr, recolección, familia, agua, barro, tetelcingo, descuento, indígén","pesos, garcía, luna, garcía luna, maría, billete, propiedad, josé, satélite, casa, josé maría, plaza, fraccionamiento, contar, noviembre","agua, zona, municipio, comunidad, proyecto, salud, centro, pueblo, puerto, población, municipal, obra, servicio, informar, autoridad","fiscalía, investigación, justicia, tribunal, delito, titular, cargo, secretario, administración, funcionario, fiscal, miguel ángel, asegurar, carmona, trabajo"
Nayarit,"mujer, destino, rever, grupo, hotel, playa, vallarta, turístico, tepic, hombre, puerto, comentario, punta, lugar, encontrar","playa, rever, destino, pesos, costa, zona, lluvia, resort, hotel, marzo, isla, tepic, hora, turístico, turismo","cuerpo, tepic, and, trabajo, proyecto, encontrar, miguel, social, lugar, actriz, casa, contar, mónico, familia, comentario","cártel, tepic, sandoval, unidos, playa, encontrar, red, zona, social, roberto, estatal, fuerte, lluvia, autoridad, roberto sandoval","niño, seguro, salud, niña, programa, hospital, presentar, municipio, gobernador, tepic, carretera, acceso, verde, cambiar, vía","tepic, vehículo, explosión, mujer, lugar, encontrar, pipa, fiscalía, autopista, informar, pueblo, federal, empresa, zona, accidente","tepic, mujer, social, playa, encontrar, federal, hijo, hotel, centro, municipio, casa, estatal, contar, riu, antonio","tepic, encontrar, salud, fiscalía, casa, social, autoridad, mujer, presentar, medida, señalar, diana, lugar, municipio, investigación"
Nuevo Leon,"mundo, vida, deber, hijo, nacer, casa, pequeño, convertir, unidos, tema, proyecto, dejar, número, contar, social","may, vida, seguridad, may seguridad, irapuato, may vida, miguel, partido, may irapuato, impuesto, ine, celaya, pesos, mayo, negar","partido, político, pri, diputado, secretario, federal, morena, alianza, trabajo, elección, dirigente, deber, reforma, pan, candidato","salud, municipio, centro, servicio, civil, municipal, protección, estatal, social, seguridad, autoridad, empresa, pesos, sector, encontrar","seat, bayern, partido, motor, minuto, versión, cupra, puerta, coche, equipo, sistema, campeón, área, generación, cambio","paso, sat, calibre, táctica, cártel, remesa, alto calibre, maquinaria, perfilar, particularmente, presunto, sísmico, emplear, narrativa, mercado","festival, edición, película, minuto, evento, coronavirus, banda, capital, esperar, leon, concierto, pandemia, norte, agua, corona","fosfo, fallecer, residente, hospital, rodríguez, garcía, samuel, leon, samuel garcía, comorbilidad, masculino, zona, masculino residente, fosfo fosfo, mariana"
Oaxaca,"efemérid, educación, educativo, escuela, escolar, ieepo, docente, servicio, social, niño, dirección, estudiante, radio, trámite, convocatoria","mujer, violencia, justicia, autoridad, estatal, humanos, fiscalía, derechos, derechos humanos, municipal, derecho, policía, investigación, federal, social","oax, municipal, juárez, agua, zona, municipio, abril, quadratín, encontrar, quadratín oax, calle, mayo, oax abril, diciembre, protección","pueblo, comunidad, sismo, territorio, lengua, daño, hotel, región, indígena, minero, municipio, indígén, local, tierra, magnitud","cultura, oaxaqueño, comunidad, cultural, trabajo, historia, proyecto, casa, vida, contar, lugar, centro, espacio, arte, pueblo","salud, mujer, contagio, sanitario, municipio, medida, santa, paciente, enfermedad, pandemia, producto, oaxaqueño, casa, turismo, servicio","murat, gobernador, alejandro murat, desarrollo, alejandro, hinojós, murat hinojós, dif, gobernador alejandro murat, gobernador alejandro, pueblo, apoyo, comunidad, alejandro murat hinojós, trabajar","salud, servicio, deber, atención, personal, médico, estatal, hospital, secretaría, contar, unidad, sanitario, ley, información, instituto"
Puebla,"municipio, pesos, empresa, comunidad, secretaría, agua, social, servicio, municipal, federal, salud, encontrar, grupo, autoridad, familia","encontrar, fiscalía, centro, hora, hospital, informar, médico, estatal, detener, servicio, autoridad, delito, policía, investigación, zona","club, equipo, guillermo, sol, pichardo, pichardo sol, guillermo pichardo, guillermo pichardo sol, liga, libre, juego, estilo, toluca, garcía, estilo libre","autoridad, reportar, salud, vía, difundir, exigir, taquería, issstep, tehuacán, noticia, local, colonia, poblano, acusar, familia","cultural, cultura, patrimonio, turismo, arte, estudio, talavera, humanidad, proceso, historia, trabajo, centro, social, tierra, reconocer","motocicleta, víctima, periférico, sam, sufrir, periférico ecológico, morir, ecológico, huir, tráiler, sam club, club, reportar, incertidumbre, video","equipo, partido, franja, club, liga, jugar, torneo, gol, encontrar, lugar, jugador, futbol, monterrey, rayado, quedar","alejandro, sexual, soto, hospital, banda, abuso, abuso sexual, tom cruise, tom, cruise, contar, gil, revelar, asegurar, sufrir"
Queretaro,"municipio, centro, servicio, estatal, juan, pesos, empresa, municipal, río, actividad, calle, qro, mayo, autoridad, policía","mundo cerca, festival, museo, trailers, maltrato animal, histórico, noticia, asegurar, relacionado, relacionado noticia, robado, nota relacionado, nota, nota relacionado noticia, detener","salud, coronavirus, médico, hospital, informar, secretaría, paciente, medida, contagio, encontrar, pandemia, personal, mujer, empleo, registrar","asegurar, sexual, abuso, abuso sexual, soto, disco, serie, comunicación, contar, tom, cruise, tom cruise, clave, sufrir, revelar","partido, equipo, gallo, liga, club, blanco, pan, querer, lugar, buscar, casa, contar, local, jugador, pri","lluvia, municipal, recorte, irregularidad, alcalde, morén, afectación, confirmar, jalpan, autoridad, nivel, salud, felipe, apagón, puga","efectivo, table, completo, descubrir, aprender, guía, conexión, guía completo, mantener, estrategia, remesa, construir, conversación, paso, amigo","información, directo, found, may, morelia, categoría, zona, cancha, archivo, auditorio, imprimir, conurbado, zona conurbado, municipal, grupo"
Quintana Roo,"seguridad, encontrar, policía, mujer, federal, borge, hotel, roberto, delito, centro, investigación, roberto borge, autoridad, fiscalía, diciembre","social, dejar, grupo, autoridad, salud, hora, banda, mujer, presentar, afectar, secretaría, noviembre, servicio, huracán, delta","borge, desarrollo, estatal, salud, médico, operación, pesos, turismo, roberto, roberto borge, imss, federal, delito, ilícito, administración","jornada, maya, sociedad, zona, internacional, político, aumentar, área, seguridad, natural, cdmx, medida, encontrar, forestal, especie","playa, encontrar, zona, familia, puerto, isla, lugar, autoridad, noticia, juárez, agua, destacado, noticia destacado, municipal, hora","chetumal, turístico, playa, zona, sanitario, noticia, destacado, turista, noticia destacado, medida, pesos, turismo, empresa, maya, pandemia","lluvia, viento, zona, fuerte, huracán, tormenta, news, norte, joaquín, máximo, centro, kilómetro, racha, tropical, sistema","quadratín, diciembre, qroo, quintán, mayo, maya, facebook, autorizado, fuente, instagram, whatsapp, reproducción, youtube, twitter, enlace"
